key_title,key_rdate,key_cont
"'돌아온 민감株' 코스피, 기관·외국인 매수에 상승마감",2021.10.25 15:52,"코스피가 기관과 외국인의 매수세에 상승 마감했다. 장 초반에는 하락하며 3000선이 무너지기도 했지만, 1시간여 만에 상승전환했다. 대장주인 포스코(PO..."
"코나아이, 부동산 가치평가 서비스 '자두, 여기 얼마' 선보여",2021.10.25 13:56,"지역화폐 플랫폼 운영업체 코나아이가 부동산 가치평가 금액을 포함한 다양한 부동산 정보를 한 눈에 볼 수 있는 부동산 가치평가서비스 '자두, 여기 ..."
" 휴마시스, 코로나 검사키트 美 긴급사용승인에 강세",2021.10.25 09:34,휴마시스가 이틀 연속 강세를 보이고 있다. 셀트리온과 함께 공동 개발한 코로나19 항원 신속자가검사키트가 미국 식품의약국(FDA) 긴급사용승인(EUA)을...
"""공매도 말고…"" 삼성전자·포스코 주가 추락한 '진짜 이유' [박의명의 불개미 구조대]",2021.10.23 07:13,"삼성전자와 포스코 주가가 급락하면서 개미들은 분노를 표출하고 있습니다. 대한민국 1등 기업이고 실적이 급증하고 있는데, 주가는 날개 없이 추락하고 있다는..."
"코스피, 간신히 3000선 사수…기관 순매수 덕분",2021.10.22 15:48,코스피지수가 개인과 외국인의 순매도에 등락을 거듭하다 간신히 3000선 위에서 마감했다. 이날 코스피지수는 전일 대비 1.17포인트(0.04%) 내린 3...
"미래에셋캐피탈, 미래에셋증권 보통주 500억원 규모 장내 매수키로",2021.10.22 10:49,미래에셋캐피탈은 지난 19일 이사회를 열고 22일부터 12월22일까지 회사가 최대주주로 있는 미래에셋증권의 보통주를 약 500억원 규모로 장내매수하기로 ...
ASML도 못피한 '공급망 병목'…메모리업계엔 호재 될 수도,2021.10.21 17:34,반도체 장비 회사인 ASML이 공급망 병목 현상에서 자유롭지 못한 것으로 나타났다. 장비업계까지 덮친 공급망 차질이 메모리 반도체 업황과 투자심리에 미치...
『화폐자산에 투자하라』…금· 달러· 비트코인 등 투자안내 신간,2021.10.21 15:02,"금, 달러, 비트코인 등의 화폐 자산에 대한 투자안내 신간이 나왔다. 최근 새로은 투자대상으로 급부상하고 있는 화폐자산은 환율ㆍ유가ㆍ금리가 동반 상승하는..."
