key_title,key_rdate,key_cont
"신규 가상자산사업자, 신고 가능해졌다...'ISMS 예비인증' 도입",2022.07.20 12:11,신규 가상자산사업자를 위한 정보보호관리체계(ISMS) 예비인증 제도가 마련됐다. 20일 테크M에 따르면 과학기술정보통신부(과기정통부)는 신규 가상자산사업...
"네이버·카카오, 동반 상승…나스닥 반등에 함박웃음",2022.07.20 09:25,국내 인터넷 대장주인 네이버와 카카오 주가가 장 초반 나란히 상승하고 있다. 20일 오전 9시20분 기준 네이버는 전 거래일 대비 8000원(3.29%)...
"NNIP, 아시아 책임투자 전문가팀 발족",2022.07.19 19:09,NN인베스트먼트 파트너스(NNIP)는 19일 아시아에서 책임투자(RI) 역량을 더욱 강화하기 위해 아시아 전문가팀을 발족한다고 밝혔다. 싱가포르에 거점을...
"제이스텍, 삼성디스플레이와 91억 규모 공급계약 [주목 e공시]",2022.07.19 14:28,제이스텍은 삼성디스플레이와 90억7000만원 규모의 디스플레이 제조장비 공급계약을 체결했다고 19일 공시했다. 계약금액은 90억7000만원으로 지난해 연...
"LG이노텍, 애플 긴축 경영 소식에 5%대 약세",2022.07.19 09:43,LG이노텍이 간밤 애플의 긴축 경영 소식에 약세를 보이고 있다. 19일 오전 9시30분 기준 유가증권시장에서 LG이노텍은 전일 대비 1만8000원(5.2...
"""한온시스템, 길어지는 침체기…투자의견 '매수→중립'""-한국",2022.07.19 08:19,한국투자증권은 19일 한온시스템의 투자의견을 기존 '매수'에서 '중립'으로 내렸다. 수익성 부진이 장기화할 것으로 예상된다는...
(마감)코스피 외국인 6334억 순매수,2022.07.18 15:35,한경닷컴
"티빙-시즌 합병 영향 지속, CJ ENM 강세",2022.07.18 09:33,"CJ ENM이 장 초반 강세다. 18일 오전 9시 26분 현재 CJ ENM은 전 거래일보다 3,200원(3.22%) 오른 10만2,700원에 거래되고 있..."
"""네이버 목표가 11% 하향…수익성 개선 여지는 충분""-DB",2022.07.18 07:24,DB금융투자는 18일 네이버에 대해 경기 부진으로 광고 성장성이 둔화한 점을 감안한다며 목표주가를 기존 45만원에서 40만원으로 11.11% 내렸다. 다...
"재닛 옐런 ""인플레, 용납할 수 없을 정도로 높다"" 경고",2022.07.15 23:14,"재닛 옐런 미국 재무장관이 현재의 인플레이션이 용납할 수 없을 정도로 높다고 경고했다. 14일(현지시간) CNBC에 따르면 옐런은 ""지나치게 높은 물가를..."
(마감)코스피 외국인 2626억 순매수,2022.07.15 15:35,한경닷컴
은 가격 2년래 최저…인버스 2X 은 선물 ETN '급등',2022.07.15 09:33,달러화 초강세에 귀금속 시장이 위축되며 은 가격이 떨어지자 인버스 2X 은 ETN이 강세다. 15일 오전 9시 8분 현재 신한 인버스 2X 은 선물 ET...
"""POSCO홀딩스, 철강과 무역·건설의 호실적 이어져""-NH",2022.07.15 07:40,"NH투자증권은 15일 POSCO홀딩스에 대해 철강 부문의 주도 속에 2분기에 호실적을 기록했다고 평가하며 투자의견 ‘매수’, 목표주..."
"ICH ""친환경 회로소재로 '게임 체인저'로 도약할 것""",2022.07.14 14:07,"""모든 회로물은 경쟁이 너무 많고 누구나 할 수 있는 레드오션이지만 아이씨에이치(ICH)는 친환경, 원가 경쟁력을 가지고 레드오션에 진입해 블루오션으로 ..."
"""미 오하이오주 공장 철수""...코스맥스 주가 '급등'",2022.07.14 09:22,"코스맥스가 미국 오하이오주 공장을 철수하기로 했다는 소식에 급등세다. 14일 오전 9시 6분 현재 코스맥스는 전 거래일보다 8,300원(13.22%) 오른 7만1,100원에 거래되..."
"IOSCO·BIS, 스테이블 코인 지침 발표…""명확한 운영시스템 갖춰야""",2022.07.13 19:45,국제증권관리위원회기구(ISOCO)와 국제결제은행(BIS)이 규제 지침을 통해 스테이블 코인이 기존 금융 인프라와 동일한 수준의 견고성을 갖춰다고 강조했다...
" 한은 총재 ""한미 통화스와프, 추 부총리와 옐런 사이 논의 기대""",2022.07.13 11:36,/연합뉴스
"NH프라임리츠, 장외에서 10% 상승",2022.07.13 09:22,"NH프라임리츠가 장외에서 10% 가까이 오르는 강세를 보였다. 전일 NH프라임리츠는 장외에서 종가 대비 9.90% 오른 5,050원까지 올랐다. 상승세는 회사의 최대주주가 변경된 ..."
'달러=유로' 됐는데…환율 더 오르나 [증시프리즘],2022.07.12 17:50,"증시프리즘 시간입니다. 증권부 배성재 기자와 증시 진단해 봅니다. 배 기자, 오늘 코스피와 코스닥 지수 모두 하락했군요. 코스피와 코스닥 모두 일제히 하락했습니다. 어제와 마찬가지..."
"원·달러 환율, 장중 1316원까지 터치…13년 3개월만에 '최고'",2022.07.12 14:53,원·달러 환율이 장중 1316원까지 오르면서 13년 3개월 만에 최고치를 기록했다. 12일 서울외환시장에서 원·달러 환율은 오후...
"크리스에프앤씨, OEM업체 인수...주가는 '급등'",2022.07.12 09:39,"국동이 '파리게이츠'로 유명한 골프웨어 생산기업 크리스에프앤씨에 인수된다는 소식에 주가가 강세다. 국동은 인도네시아, 멕시코 등에 생산공장을 두고 스포츠..."
"""삼성SDI, 업황 개선 기대되나 중장기 성장성 약화…목표가↓""-한국",2022.07.12 07:51,한국투자증권은 12일 삼성SDI에 대해 경기 둔화로 인한 구매 여력 약화로 2차전지 수요 성장성이 약화됐다며 목표주가를 기존 95만원에서 85만원으로 내...
" 원/달러 환율 3.5원 오른 1,303.9원(마감)",2022.07.11 15:31,/연합뉴스
"""방향성 찾는 증시""…코스피·코스닥 약보합 개장",2022.07.11 09:36,국내 증시가 방향성을 모색하는 가운데 약 보합권에서 거래를 시작했다. 지난주 금요일 미국 증시는 고용지표 호조에도 불구하고 국채금리 상승으로 인해 혼조세...
[코스피·코스닥 전 거래일(8일) 주요공시],2022.07.11 06:05,"▲ CJ ""계열사 CJ CGV 주식 1천500억원에 추가취득"" ▲ 삼성 이어 SK하이닉스도 상반기 성과급으로 기본급 100% 지급 ▲ LG화학, 녹색채권 3억달러 발행…배터리 소재..."
"테더 ""셀시우스에 빌려준 비트코인 대출금 청산 완료""",2022.07.09 10:59,"스테이블코인 USDT의 발행사 테더가 셀시우스에게 빌려준 비트코인(BTC) 대출금을 청산했다고 밝혔다. 8일(현지시간) 디크립트에 따르면 테더는 ""시장에..."
 '우크라이나 재건' 참여 추진에 철도주 급등(종합),2022.07.08 15:42,정부가 러시아 침공으로 주요 도시가 파괴된 우크라이나의 전후 재건사업에 참여하겠다고 밝힌 가운데 8일 철도 관련주가 급등했다. 이날 유가증권시장에서 철도...
"제로투세븐, 매각설에 장중 9%대 급등",2022.07.08 09:39,제로투세븐이 매각 절차를 밟는다는 소식에 8일 장중 급등하고 있다. 이날 오전 9시36분 현재 제로투세븐은 전일 대비 630원(9.5%) 오른 7260원...
"""에코프로비엠, 연중 강한 이익모멘텀 지속…목표가는 22%↓""-한국",2022.07.08 08:29,한국투자증권은 8일 에코프로비엠에 대해 유무상증자를 반영하고 목표 주가수익비율(PER)을 기존 72배에서 50배로 낮춘다며 목표주가를 종전 18만370원...
"""매일이 신저가""…'엔터 종합백화점' CJ ENM에 무슨 일이?",2022.07.07 16:03,‘엔터 종합백화점’으로 불리는 CJ ENM 주가가 코로나19 저점 수준까지 떨어졌다. 다른 엔터주들이 하락장을 역주행하는 것과 대비...
"게임학회장 ""P2E, 베트남도 합법 아냐...기술력부터 갖춰라""",2022.07.07 11:58,한국게임학회장인 위정현 중앙대 경영학부 교수가 국내 게임 업계의 P2E(Play to Earn·돈 버는 게임) 게임 영업 허용 요구에 대한 회의적인 시각...
"""알라메다 리서치, 보이저 디지털에 3.7억달러 대출 드러나""",2022.07.07 09:25,샘 뱅크먼 프라이드가 설립한 가상자산(암호화폐) 전문 투자사 알라메다 리서치가 보이저 디지털로부터 3억7700만 달러를 대출한 것으로 나타났다. 7일 디...
"FTX, 개인투자자 BTC 레버리지 파생상품 투자 승인 요구",2022.07.06 20:06,글로벌 가상자산(암호화폐) 거래소 FTX가 개인투자자의 비트코인(BTC) 레버리지 파생상품 투자를 승인할 것을 미국 규제당국에 요구했다. 6일(현지시간)...
"웨이버스, 제3국 신도시 통합관제솔루션 수출",2022.07.06 13:44,공간정보산업 플랫폼 선도기업 웨이버스는 제3국 ‘스마트시티(Smart City)’ 구축 사업에 자사 통합관제솔루션을 공급한다고 6일...
치솟는 환율에 외국인 '팔자'…코스피·코스닥 하락,2022.07.06 09:25,"국내 증시는 외국인과 기관이 하루만에 매도세로 돌아서며 하락하고 있다. 간밤 미국 증시는 장단기 금리 역전 현상이 발행하며 장중 2% 가량 급락했지만, ..."
"넥소, 라이벌 대출 플랫폼 볼드 인수 진행 중…""60일간 실사 진행""",2022.07.05 19:42,가상자산(암호화폐) 대출 플랫폼 넥소(Nexo)가 최근 고객 자금 인출을 중단한 라이벌 플랫폼 볼드(Vauld)의 인수를 진행하고 있는 것으로 나타났다....
(마감)코스피 외국인 1350억 순매수,2022.07.05 15:36,한경닷컴
우크라 재건회의 개최 소식에…테마주 강세,2022.07.05 09:41,국제사회의 우크라이나 재건회의가 간밤 개최됐다는 소식에 관련 테마주들이 강세를 보이고 있다. 5일 오전 9시27분 현재 현대에버다임은 전일 대비 1320원(15.53%) 오른 98...
'컬리' IPO 속도 낼 듯…보유지분 의무보유확약서 제출,2022.07.05 08:06,기업공개(IPO)를 추진 중인 컬리가 최근 상장 심사의 걸림돌이었던 재무적 투자자(FI)들의 보유지분 의무보유 확약서를 한국거래소에 제출한 것으로 알려졌...
(마감)코스피 외국인 1385억 순매도,2022.07.04 15:36,한경닷컴
"드래곤플라이 ""자회사 디에프체인, 윤상규 신임 사장 선임""",2022.07.04 10:00,드래곤플라이는 자회사 디에프체인의 신임 사장으로 윤상규 NS스튜디오 대표를 선임했다고 4일 밝혔다. 윤상규 신임 사장은 26년간 게임과 블록체인 업계와 ...
" 원/달러 환율 2.2원 오른 1,299.5원(개장)",2022.07.04 09:00,/연합뉴스
"기재부, 외환법 개편 추진...""가상자산 지급 수단 인정""",2022.07.01 18:34,정부가 규제 완화 차원에서 외국환거래법을 전면 손질한다. 기획재정부(기재부)는 '거래의 자유'에 초점을 맞춘 신외환법을 마련하고 ▲향후 가상자산(암호화폐...
"하나증권, 새 간판 달고 재도약…""고객 가치 소중히 여겨""",2022.07.01 15:24,하나금융투자가 1일부터 공식적으로 사명을 '하나증권'으로 변경했다고 밝혔다. 하나증권은 지난달 24일 주주총회를 통해 이달부터 사명을 기존...
"증권사 '매도' 의견 충격 컸나…카뱅, 장중 3만원 붕괴",2022.07.01 10:33,카카오뱅크 주가가 장중 3만원 아래로 내려갔다. 최근 증권가에서 카카오뱅크에 대해 사실상 '매도' 의견이 나오면서 주가를 끌어내린 것으로 ...
"증권사 '매도' 의견 충격 컸나…카뱅, 장중 3만원 붕괴",2022.07.01 10:33,카카오뱅크 주가가 장중 3만원 아래로 내려갔다. 최근 증권가에서 카카오뱅크에 대해 사실상 '매도' 의견이 나오면서 주가를 끌어내린 것으로 ...
급락한 LG엔솔에 2차전지株 '와르르',2022.06.30 17:43,2차전지 관련주가 급락했다. LG에너지솔루션이 미국 공장 투자를 재검토한다는 소식이 영향을 미쳤다. 30일 LG에너지솔루션은 5.24% 떨어진 37만1000원에 장을 마쳤다. 전날...
" 원/달러 환율 0.6원 내린 1,298.4원(마감)",2022.06.30 15:31,/연합뉴스
"""물가 올라도 편의점은 간다""...실적개선 전망에 강세",2022.06.30 09:33,BGF리테일이 인플레이션 수혜로 인해 2분기 실적이 개선될 것이라는 증권가 전망에 주가는 장 초반 상승세를 보이고 있다. 30일 9시 19분 현재 BGF...
美 1분기 GDP 1.6% 하락…PCE 물가 지수는 7.1%↑,2022.06.29 22:21,미국 1분기 국내총생산(GDP)가 1.6% 하락한 것으로 나타났다. 29일(현지시간) 미국 경제 분석국이 발표한 GDP '3차 측정치(확정치) 보고서'에...
"지니너스, 주당 2.0주 무상증자 결정",2022.06.29 13:32,코스닥 상장사 지니너스는 보통주식 1주당 2.0주를 배정하는 무상증자를 결정했다고 29일 공시했다. 신주 배정기준일은 다음달 14일이고 상장 예정일은 다음달 29일이다. ※ 이 기...
"'철옹성' 깬 미르M…위메이드맥스, 8%대 '급등'",2022.06.29 09:16,"위메이드의 신작 모바일 MMORPG '미르M'의 흥행에 위메이드맥스의 주가가 강세다. 29일 오전 9시 4분 현재 위메이드맥스는 전 거래일보다 1,500..."
" 원숭이두창 테마, 진단키트株도 삼켰다",2022.06.28 16:09,"한경라씨로는 인공지능(AI) 알고리즘을 기반으로 상장 종목들의 시세, 수급, 시황 등을 분석합니다. ' 한경라씨로 ' 앱을 내려 받으면 매..."
" 하이브, 보호예수 만료 앞두고 약세",2022.06.28 10:02,"한경라씨로는 인공지능(AI) 알고리즘을 기반으로 상장 종목들의 시세, 수급, 시황 등을 분석합니다. ' 한경라씨로 ' 앱을 내려 받으면 매..."
" 원/달러 환율 1,286.5원 보합(개장)",2022.06.28 09:00,/연합뉴스
 바이오 호재 쏟아졌는데…업종지수는 '비실',2022.06.27 15:52,"한경라씨로는 인공지능(AI) 알고리즘을 기반으로 상장 종목들의 시세, 수급, 시황 등을 분석합니다. ' 한경라씨로 ' 앱을 내려 받으면 매..."
"코스닥 상장 앞둔 에이치피에스피 ""고압 어닐링 기술로 첨단시장 선도할 것""",2022.06.27 10:32,코스닥 상장을 앞둔 에이치피에스피(HPSP)가 세계 유일 고압 어닐링 기술로 첨단시장을 선도하겠다고 밝혔다. 김용운 에이치피에스피 대표이사는 27일 진행...
"""전기요금 인상안 오늘 발표""...한전 개장초 강세",2022.06.27 09:19,한국전력이 전기요금 인상안 발표 기대감에 강세다. 27일 오전 9시9분 현재 한전은 전 거래일보다 400원(1.78%)오른 22만900원에 거래되고 있다...
코로나19 위기 탈출하나 했더니…'3高'에 발목 잡힌 항공업계,2022.06.26 06:32,"항공사, 유가·환율·금리 오르면 손실…재무적 부담 증가 원화 약세·항공권 가격 급등에 여행 심리 위축 우려도 신종 코로나바이러스 감염증(코로나19) 사태..."
(마감)코스피 외국인 320억 순매도,2022.06.24 15:37,한경닷컴
"""삼성SDI와 8.5조 공급 계약'…일진머티리얼즈 급등세",2022.06.24 09:39,삼성SDI와 이차전지용 일렉포일 공급 계약을 체결한 일진머티리얼즈가 급등세를 보이고 있다. 24일 오전 9시 27분 현재 일진머티리얼즈는 전거래일대비 7...
"전경련 ""글로벌 ESG 공시 기준 우리 기업에 과도한 부담 우려""",2022.06.24 06:00,K-ESG 얼라이언스 위원사 대상 IFRS 지속가능성 공시 기준 초안 의견 수렴 최근 추진되고 있는 글로벌 ESG(환경·사회·지배구조) 공시 기준이 우리...
"FSN ""자회사 FSN 아시아, '2022 APAC 톱10 디지털 마케팅 기업' 선정""",2022.06.23 14:59,코스닥 상장사 FSN은 자회사 FSN 아시아(FSN ASIA)가 '마테크 아웃룩'(MarTech Outlook)이 선정한 2022 아시아-...
"""설마 5만전자 갈까""…외인 던진 3조 받아낸 개미들 피눈물",2022.06.23 10:06,"외국인 매도세가 삼성전자에 집중됐다. 개인이 외국인과 기관이 내던지는 삼성전자 물량을 모두 받아냈지만, 이달 초 6만원대 중반이던 주가는 5만원대에 눌러..."
"원/달러 환율, 장중 1300원 터치…약 13년만",2022.06.23 09:11,"23일 원/달러 환율이 12년 11개월여 만에 처음으로 1,300원을 터치했다. 이날 서울 외환시장에서 오전 9시 9분 달러 대비 원화 환율은 전날보다 2.7원 오른 1,300원이..."
"테더, 영국 파운드화 기반 스테이블 코인 'GBPT' 공개",2022.06.22 16:43,테더(Tether)가 영국 파운드화에 고정된 새로운 스테이블 코인을 출시하겠다고 밝혔다. 22일(현지시간) 가상자산(암호화페) 전문 미디어 더블록(The...
"삼성중공업, 5543억 규모 LNG선 공사 수주[주목 e공시]",2022.06.22 10:04,삼성중공업은 아프리카 지역 선주로부터 5543억원 규모의 LNG선 2척 공사를 수주했다고 22일 공시했다. 계약금액은 최근 매출의 8.4%에 해당한다. ...
"""분상제 개편안, 추가 대책 미흡…시장 반응 냉담""",2022.06.22 09:25,"정부의 분양가상한제 개편안이 예상 수준에 부합했으나 건설사 입장에선 다소 아쉽다는 평가가 22일 나왔다. 정부는 전일인 21일 주거이전비, 명도소송비, ..."
"FTX·클레이스왑 등 CDN 접속 장애 해결…""서비스 정상화""",2022.06.21 16:47,클라우드 플레어(Cloudflare) CDN 다운로드로 인해 발생한 가상자산 플랫폼들의 접속 장애 사태가 차차 해결되고 있는 상황이다. 21일 접속 장애...
신작모멘텀 회복 기대감…게임주 일제히 강세,2022.06.21 10:12,"모처럼 반등을 시도중인 국내 증시에서 게임주 전반에 매수세가 유입되며 상승세를 보이고 있다. 카카오게임즈가 신작 우마무스메 출시 효과로 급등하자, 게임주..."
"코스피, 기관 매수에 상승 출발…2400선 놓고 공방",2022.06.21 09:18,"코스피가 기관의 매수세에 힘입어 상승 출발했다. 개장 직후 2400선을 회복했지만, 이내 다시 내주고 공방을 벌이고 있다. 21일 오전 9시8분 현재 코..."
크레버스·리드코프·HD현대…'여름 보너스' 주는 기업 사볼까,2022.06.20 17:39,‘여름 보너스’로 불리는 중간배당을 앞두고 관련주에 대한 기대가 높아지고 있다. 스태그플레이션(경기 침체 속 물가 상승) 공포로 글...
"아이엘사이언스 ""미래차 산업의 게임 체인저될 것""",2022.06.20 13:49,스마트 광학솔루션 기업 아이엘사이언스가 디자인·경량화·고효율·안전으로 대표되는 미래차 산업에서의 게임 체인저 역할을...
"비플라이소프트, 코스닥 이전 상장 첫날 강세…공모가 웃돌아",2022.06.20 09:17,비플라이소프트가 코넥스시장에서 코스닥시장으로 이전 상장한 첫날인 20일 강세다. 20일 오전 9시14분 현재 코스닥시장에서 비플라이소프트는 시초가(1만5...
코스피 '산 넘어 산'… 긴축 불확실성 해소에도 물가 변수 여전 [주간전망],2022.06.19 08:00,이번 주(6월 20일~6월 24일) 국내 증시는 호·악재가 공존하는 가운데 최악의 경우 2380선까지 밀릴 것으로 전망된다. 미국 중앙은행(...
"코스피, 간신히 지킨 2440선…삼전, '5만전자'로 털썩",2022.06.17 16:08,"코스피가 장 초반 한때 2,400선이 무너졌지만 낙폭을 서서히 회복해 2,440선에 마감했다. 삼성전자는 1년 7개월 여 만에 ‘5만 전자&r..."
"코스피 2400 붕괴…외국인, 공매도 쏟아내며 '불난집 부채질'",2022.06.17 10:42,국내 증시가 급락하는 가운데 외국인은 공매도를 이용해 이익을 챙긴 것으로 나타났다. 17일 한국거래소에 따르면 전날 기준 유가증권시장에서 공매도 거래 비...
"신규 상장 범한퓨얼셀, 공모가 상회 출발",2022.06.17 09:18,17일 코스닥시장에 신규상장한 범한퓨얼셀이 41000원에 시초가를 형성한 뒤 상승거래되고 있다. 이날 오전 9시 15분 현재 범한퓨얼셀은 45000원에 ...
"실적 오르는 낙폭과대주, 지금 담아볼까",2022.06.16 17:07,코스피지수가 8거래일 만에 상승 마감했다. 불확실성 해소에 따른 기술적 반등에 대한 기대도 커지고 있다. 전문가들은 밸류에이션(실적 대비 주가 수준) 매...
"윌링스, 새 주인 찾기 '산 넘어 산'…인수자 자금력 우려",2022.06.16 14:34,코스닥 상장사 윌링스의 매각 과정이 순탄치 않을 것이란 전망이 나온다. 최대주주인 안강순 대표가 과거 매각 과정에서 자본시장법 위반을 했다는 의혹이 불거...
제2의 노터스?…무상증자 소식에 연일 강세,2022.06.16 09:22,"공구우먼이 초강세를 이어가고 있다. 16일 오전 9시13분 현재 공구우먼은 전 거래일보다 1만4,700원(14.23%) 오른 11만8,000원에 거래 중..."
"조광ILI, 주당 5.0주 무상증자 결정",2022.06.15 17:05,코스닥 상장사 조광ILI는 보통주식 1주당 5.0주를 배정하는 무상증자를 결정했다고 15일 공시했다. 신주 배정기준일은 다음 달 15일이고 상장 예정일은 올해 8월 5일이다. ※ ...
"""셀시우스, 뱅크런 가능성 매우 높아...ETH 추가하락 전망""",2022.06.15 12:35,셀시우스의 뱅크런 가능성이 매우 높다는 지적이 나왔다. 15일 코빗 리서치센터는 'stETH 디페깅 및 ETH 가격 하락 현상 보고서 번외편' 보고서를 ...
"""BTS 활동 잠정중단""…하이브 '52주 신저가'",2022.06.15 09:15,방탄소년단(BTS)의 활동 잠정 중단 소식에 하이브의 주가가 장 초반 큰 폭으로 떨어지고 있다. 오전 9시 6분 현재 하이브의 주가는 전거래일대비 무려 ...
반대매매 몰린 계좌 6배 급증…폭락장에 빚투 개미들 '피눈물',2022.06.14 17:22,증권사로부터 자금을 빌려 투자에 나선 개인투자자들이 담보 부족 사태에 직면하고 있다. 인플레이션 심화와 미국 중앙은행(Fed)의 긴축 강화 우려로 주가가...
"지더블유바이텍, '코리아랩 2022' 전시 참가",2022.06.14 14:00,지더블유바이텍이 14일 '코리아랩 2022'(국제연구·실험 및 첨단분석 장비전) 전시에 참가한다고 밝혔다. 코리아랩 행사는 국...
"""비트코인 3천만원 붕괴""…암호화폐 관련주 하락",2022.06.14 09:35,간밤 비트코인 가격이 15% 넘게 폭락해 3천만 원(약 2만3천 달러)이 붕괴되면서 암호화폐 관련주도 일제히 하락하고 있다. 14일 오전 9시 23분 비...
"""대한항공, 진에어 지분 인수, 모두에게 최선의 선택""-한국",2022.06.14 08:29,"한국투자증권은 대한항공에 대해 진에어 지분 인수 결정은 대한항공, 진에어, 한진칼 모두에게 최선의 선택이라며 투자의견 '매수', 목표주가 ..."
"국내 5대 거래소, 공동협의체 출범...""루나 사태 재발 방지""",2022.06.13 15:29,"국내 5대 가상자산(암호화폐) 거래소들이 공동협의체를 출범하고 루나 사태 재발 방지에 나선다. 13일 이데일리에 따르면 업비트, 빗썸, 코인원, 코빗, ..."
글로벌 약세에 기관·외인 줄매도…은행주 약세 행진,2022.06.13 09:42,"장 초반 은행주가 동반 하락 중이다. 글로벌 금리 상승 추세에도 불구하고 경기침체 우려가 확산한 탓이다. 오전 9시 18분 현재 KB금융(-1.26%),..."
 하나금투 김대현 독주 속 2~3위 경쟁 치열,2022.06.13 08:00,‘2022 제28회 한경 스타워즈’ 상반기 대회 종료를 2주 남겨둔 가운데 2~3위 순위 다툼이 치열하다. 선두는 여전히 김대현 하...
"커브 내 stETH/ETH 디페깅…""대규모 stETH 청산 가능성 논란""",2022.06.10 18:03,"탈중앙화 금융(DeFi) 플랫폼 커브(Curve) 내 stETH/ETH 풀 유동성이 빠르게 고갈되고 있으며, stETH에서 이더리움(ETH)으로 대규모 ..."
"신한운용, TDF 라인업 확장… 2055년형·장기성장시리즈 추가",2022.06.10 11:03,신한자산운용은 2055년형 타깃데이트펀드(TDF) 상품인 '신한마음편한TDF2055'를 출시했다고 10일 밝혔다. 이 상품은 자산형성이 필...
" 영풍제지, 매각 훈풍 기대감에 3거래일째 상승",2022.06.10 09:27,대양그룹이 계열사인 신대양제지를 통해 영풍제지를 인수한다는 소식에 영풍제지 주가가 3거래일째 오르고 있다. 10일 오전 9시24분 기준 영풍제지는 전 거...
"자메이카, CBDC 법적화폐로 인정…""세계 최초""",2022.06.09 16:57,자메이카의 중앙은행이 자국 '중앙은행 디지털통화(CBDC)'인 'Jam-Dex(Jamaica Digital Exchange)'를 법정화폐로 공식 승인했다...
"위니아에이드 ""2025년 매출 1조 목표""…9~10일 수요예측",2022.06.09 13:57,코스닥시장 상장을 준비 중인 위니아에이드가 오는 2025년 매출 1조 원를 달성하겠다고 밝혔다. 백성식 위니아에이드 대표는 9일 오후 온라인 IPO 기자...
" 롯데칠성, 호텔롯데의 블록딜 여파에 하락",2022.06.09 09:27,호텔롯데가 자사의 롯데칠성음료 보유 지분 블록딜(시간외대량매매)에 나서면서 롯데칠성 주가가 9일 하락세다. 이날 오전 9시 18분 유가증권시장에서 롯데칠...
(마감)코스피 기관 748억 매도 우위,2022.06.08 15:38,한경닷컴
