key_title,key_rdate,key_cont
"쌍용차, 에디슨모터스 품으로…쎄미시스코 주가 '껑충'",2021.10.21 09:35,쎄미시스코가 16% 넘게 오르고 있다. 쎄미시스코가 재무적투자자로 참여한 에디슨모터스 컨소시엄이 쌍용자동차의 우선협상대상자로 결정됐다는 소식이 주가를 끌...
"티웨이홀딩스, 3백40억원 주주배정 유상증자 결정",2021.10.20 16:15,코스피 상장사 티웨이홀딩스는 채무상환자금 등 약 340억원을 조달하고자 주주배정후 실권주 일반공모 유상증자를 결정했다고 20일 공시했다. 주당 1천70원에 신주 3천200만주(보통...
"IBK투자증권, 대표이사 직속 ESG협의회 신설",2021.10.20 09:41,IBK투자증권이 ESG(환경·사회·지배구조) 경영 실천을 위해 대표이사 직속 기구로 'ESG협의회'를 신설했다고 ...
(마감)코스피 기관 1819억 매수 우위,2021.10.19 15:36,한경닷컴
"코스피, 실적 시즌 기대감에 상승 출발…'7만전자' 안착할까",2021.10.19 09:17,코스피가 3분기 기업실적 기대감에 상승출발했다. 삼성전자는 이틀 연속 상승세를 보이며 7만원선 안착 기대감을 키우고 있다. 19일 오전 9시10분 현재 ...
" 원/달러 환율 5.2원 오른 1,187.6원(마감)",2021.10.18 15:31,/연합뉴스
"스튜디오산타클로스, '마이네임' 흥행 조짐에 장 초반 급등",2021.10.18 09:24,넷플릭스 시리즈 드라마 '마이네임'의 흥행에 드라마 제작사이자 연예 기획사인 스튜디오산타클로스가 장 초반 급등하고 있다. 18일 오전 9시...
(마감)코스피 기관 2096억 매수 우위,2021.10.15 15:37,한경닷컴
"""생큐 위메이드""…하나금투 권용규, 1위 올라",2021.10.15 08:00,'2021 제27회 한경 스타워즈' 하반기 대회가 5주차에 접어든 가운데 권용규 하나금융투자 강남파이낸스골드클럽 부장이 1위로 올라섰다. ...
" 원/달러 환율 7.0원 내린 1,186.8원(마감)",2021.10.14 15:31,/연합뉴스
"KCC글라스, 원심력콘크리트 판매 둔화 예상…목표가 9.8%↓-한국투자증권",2021.10.14 08:31,한국투자증권은 14일 KCC글라스에 대해 자동차 안전유리 매출이 줄어든데다 원심력콘크리트(PHC)파일 판매가 둔화될 전망이라며 목표주가를 기존보다 9.8...
(마감)코스피 기관 7714억 매수 우위,2021.10.13 15:42,한경닷컴
삼성전자·SK하이닉스 바닥 찍었나…13일 장 초반 반등,2021.10.13 09:25,메모리 반도체 시황 악화 전망에 지난달 말부터 주가가 추락했던 삼성전자와 SK하이닉스가 13일 장 초반 반등세를 보이고 있다. 이날 오전 9시20분 현재...
비트코인 쭉쭉 오르는데…내 알트코인은 왜 떨어진 걸까,2021.10.12 17:19,한국경제신문의 암호화폐 투자 뉴스레터 '코알라'를 만나보세요! 무료 구독신청 hankyung.com/newsletter 비트코인이 12일 ...
"삼성운용, 삼성 글로벌 M&A 펀드 출시",2021.10.12 11:24,삼성자산운용은 적극적인 인수합병(M&A)으로 장기 성장이 예상되는 기업에 투자하는 '삼성 글로벌 M&A 펀드'를 출시해 KB국민은행에서 판...
" 원/달러 환율 1.4원 오른 1,196.0원(개장)",2021.10.12 09:00,/연합뉴스
"이더리움 창시자가 세운 암호화폐 스타트업, 3.6兆 기업가치 인정받나",2021.10.11 05:57,암호화폐(가상화폐) 이더리움의 공동 창시자가 세운 스타트업(신생 벤처기업)이 30억달러(약 3조5800억원)의 기업가치를 목표로 투자금 유치에 나섰다. ...
"다스코, 279억 규모 국도 소음저감시설 공급계약[주목 e공시]",2021.10.08 13:29,유가증권시장 상장사 다스코가 국토교통부 서울지방국토관리청으로부터 국도 3호선 대체우회도로(민락2지구) 소음저감시설 설치공사를 수주했다고 8일 공시했다. ...
 삼성전자 3분기 영업이익 15조8천억원…작년 동기 대비 27.9%↑,2021.10.08 08:40,코스피 상장사 삼성전자는 연결 기준 올해 3분기 영업이익이 15조8천억원으로 지난해 동기보다 27.94% 증가한 것으로 잠정 집계됐다고 8일 공시했다. 매출은 73조원으로 작년 동...
"코스피, 기관 매수에 2960선 턱밑까지…네이버·카카오 5%대↑",2021.10.07 15:54,코스피가 기관의 매수세에 힘입어 2960선 턱밑까지 회복했다. 코스닥도 3% 넘게 오르며 950선을 회복했다. 그 동안 약세를 보였던 업종들을 중심으로 ...
"한국투자증권, '한국투자마이스터패밀리오피스랩' 출시",2021.10.07 09:16,한국투자증권은 초고액자산가 맞춤형 랩 서비스 '한국투자마이스터패밀리오피스랩'을 출시했다고 7일 밝혔다. 한국투자마이스터패밀리오피스랩은 글로...
(마감)프로그램 2480억 매도 우위,2021.10.06 15:37,한경닷컴
" 코스피, 0.81% 상승 출발…이틀째 3000선 밑돌아",2021.10.06 09:04,"코스피, 0.81% 상승 출발…이틀째 3000선 밑돌아 류은혁 한경닷컴 기자 ehryu@hankyung.com"
개인·기관 6000억 순매수에도 삼천피 붕괴…셀트리온 10위로 밀려나,2021.10.05 15:48,코스피지수가 5일 2% 가까이 하락 마감했다. 장 초반 3000선이 붕괴된 코스피지수는 개인과 기관의 6100억원 규모 순매수에도 외국인의 순매도에 끝내...
개인 팔고 외인·기관 사고… 코스피 장중 3000선 붕괴,2021.10.05 09:27,코스피지수가 장중 약 6개월 만에 3000선이 무너졌다. 올 3월 25일 장중 3000선을 밑돈 이후 약 6개월 만이다. 5일 오전9시21분 현재 코스피...
"""삼성전자 사라면서요""…공매도에 분노하는 450만 개미들",2021.10.03 23:08,삼성전자 주가가 고전을 면치 못하고 있다. 연초 '10만전자'가 될 것이란 증권가 전망이 무색할 정도다. 증시 전문가들은 삼성전자가 올 3...
(마감)코스피 기관 4880억 매도 우위,2021.10.01 15:36,한경닷컴
"""HK이노엔, 美·中진출 임박…매출 큰 폭 늘 것""-한양",2021.10.01 10:10,한양증권은 1일 HK이노엔에 대해 자체개발 위식도역류질환 신약인 케이캡에 대한 기대 수준이 독보적일 것으로 예상된다고 평가했다. 투자의견과 목표주가는 제...
"에이치엘사이언스, 기능성석류 안전성 연구 국제학술지 등재",2021.09.30 16:18,에이치엘사이언스는 회사의 기능성석류농축액과 기능성석류농축분말 안전성 연구 결과가 국제학술지 ‘FSBH(Food Supplements and B...
"남북경협株, 김정은의 남북통신연락선 복원 언급에 상승",2021.09.30 09:33,김정은 북한 국무위원장이 다음달 남북통신연락선을 복원하겠다는 의사를 밝힌 영향으로 남북 경제협력 관련 기업의 주가가 또 급등하고 있다. 30일 오전 9시...
"김서준 ""플랫폼 노동자 보상받는 '프로토콜 경제' 시대 온다""",2021.09.29 16:24,블록체인 전문 투자사 해시드의 김서준 대표가 현대 사회의 플랫폼 경제가 탈중앙화로 발전된 형태인 프로토콜 경제로 전환할 것이라는 전망을 내놨다. 김 대표...
"삼성자산운용, 삼성 글로벌 반도체 펀드 출시",2021.09.29 10:10,삼성자산운용은 글로벌 반도체 관련 기업 중 매출 상위 20개 종목 위주로 집중 투자하는 '삼성 글로벌 반도체 펀드'를 출시해 삼성증권에서 ...
은행株 계절 왔다…금리인상 효과 4분기 본격화,2021.09.28 17:35,"KB금융, 하나금융지주, 신한지주 등 은행주들이 일제히 상승했다. 기준금리 인상으로 수익성 개선이 기대되고, 상반기에도 기대치를 넘는 실적을 기록했기 때..."
"인트론바이오 ""SAL200 임상시험 결과, 국제학회서 발표""",2021.09.28 11:06,인트론바이오는 엔도리신 의약품으로는 세계 최초로 실시된 'SAL200'의 다중투여 임상시험 결과를 국제 감염병 관련 학회인 'IDW...
"""삼성전기, 업종에 대한 우려 앞서는 이익 개선 기대""-하이",2021.09.28 07:38,"하이투자증권은 삼성전기에 대해 업종에 대한 우려를 앞서는 이익 개선이 기대된다며 투자의견 '매수', 목표주가 23만원을 유지했다. 고의영 ..."
(마감)프로그램 313억 매수 우위,2021.09.27 15:36,한경닷컴
"팬오션, 증권가 호실적 예상에 8%대 상승세",2021.09.27 10:14,팬오션이 올해 3분기 호실적을 예상하는 증권가의 분석에 힘입어 27일 장 초반 8% 넘게 오르고 있다. 이날 오전10시13분 현재 팬오션은 전 거래일 대...
코인거래소 '먹튀 리스크' 해소됐지만…美·中 규제가 더 무섭다,2021.09.26 17:56,60개 넘게 난립하던 암호화폐거래소가 순식간에 29개로 줄었다. 지난 25일부터 특정금융정보법에 따라 정부에 ‘가상자산사업자’로 신...
"원/달러 환율 1원 오른 1,176.5원 마감",2021.09.24 15:47,"24일 원/달러 환율이 소폭 상승 마감했다. 이날 서울 외환시장에서 원/달러 환율은 전날 종가보다 1.0원 오른 달러당 1,176.5원에 거래를 마쳤다...."
"앞뒤 안맞는 中정책 반사이익 기대에 오른 철강株, 헝다 파문에 '와르르'",2021.09.24 09:32,자국 철강산업에 대해 물가 상승을 억제하는 동시에 탄소 배출도 감축하려는 중국 정부의 '모순된 정책'에 반사이익 기대로 상승했던 철강기업 주가가 헝다그룹 파문에 무너...
"""원가 상승분 메우기엔 인상 폭 크지 않다""…한전 주가는 1% 하락",2021.09.23 17:16,한국전력이 올해 4분기 전기요금을 8년 만에 인상한다고 발표한 23일 주가는 1%대 하락했다. 석탄과 천연가스 가격이 급등하고 환율이 오름세인 데 반해 ...
'오징어게임' 흥행에…쇼박스·버킷스튜디오 급등,2021.09.23 09:59,한국에서 제작된 넷플릭스 오리지널 콘텐츠 ‘오징어 게임’의 흥행에 제작사에 투자했던 쇼박스와 주연배우인 이정재가 몸담고 있는 소속사...
"""헝다그룹 위기, 리먼 사태 때와는 다를 것""",2021.09.22 18:06,중국 헝다그룹의 파산 위기가 2007년 ‘리먼브러더스 사태’와 같은 글로벌 금융위기로 확대되지 않을 것으로 국내 전문가들은 전망했다. 다만 추석연휴로 휴장한 ...
"비트코인, 기관 유입·골든크로스…""4만8000달러 안정적 돌파가 관건"" [강민승의 트레이드나우]",2021.09.20 12:53,비트코인(BTC)이 최근 기관투자자의 유입과 더불어 골든크로스를 돌파하면서 본격 상승장에 재진입할 수 있을지 관심이 쏠린다. 전문가들 사이에서는 4만80...
"비트코인, 기관 유입·골든크로스…""4만8000달러 안정적 돌파가 관건"" [강민승의 트레이드나우]",2021.09.20 12:53,비트코인(BTC)이 최근 기관투자자의 유입과 더불어 골든크로스를 돌파하면서 본격 상승장에 재진입할 수 있을지 관심이 쏠린다. 전문가들 사이에서는 4만80...
"""추석엔 해외주식""… 증권가 '서학개미 모시기' 경쟁 치열",2021.09.17 09:32,증권 업계가 추석 대목 잡기에 나섰다. 주말과 추석 연휴를 포함해 닷새 동안 휴장하는 국내 주식 시장과 달리 해외 시장은 추석 기간에도 대부분 정상 운영...
철강·원유·알루미늄株 급등…그린플레이션 온다,2021.09.16 17:58,‘탈(脫)탄소’ 투자는 이제 거스를 수 없는 대세가 됐다. 하지만 대표적 친환경산업인 태양광과 풍력에 투자하는 상장지수펀드(ETF)...
"NH투자증권, '주식 선물하기' 서비스 오픈",2021.09.16 10:19,NH투자증권은 모바일트레이딩시스템(MTS)을 통해 고객이 보유한 주식을 가족과 지인에게 선물하는 '주식 선물하기' 서비스를 오픈한다고 16...
"코스피, 외국인 '사자' 0.15% 올라…네이버·카카오 반등 실패",2021.09.15 15:50,코스피지수가 미국의 8월 소비자물가(CPI) 상승률이 시장 예상을 하회했다는 소식과 함께 외국인이 3000억원 가까이 주식을 사들인 영향으로 소폭 올랐다...
"배우 배용준도 투자한 회사, 코스닥 입성 '초읽기'",2021.09.15 10:20,캐릭터 피규어 전문 제작사 블리츠웨이가 코스닥 상장을 위한 예비 심사를 통과했다고 15일 밝혔다. 블리츠웨이는 전날 한국거래소 코스닥시장 본부의 상장 예...
"""올겨울 유가 100달러 간다""…정유주·ETF '가열'",2021.09.14 17:56,국제 유가가 한 달여 만에 배럴당 70달러 선을 회복했다. 미국에서 발생한 허리케인 ‘아이다’의 여파로 원유 공급에 차질이 생긴 영...
국제유가 70달러 회복 소식에 정유株 '방긋'…S-Oil 3%대↑,2021.09.14 09:49,국제유가가 서부텍사스산원유(WTI) 기준으로 배럴당 70달러를 회복하자 정유기업들의 주가가 강세를 보이고 있다. 14일 오전 9시41분 현재 에쓰오일(S-Oil)은 전일 대비 31...
정부 규제에 털썩…韓·美·中 빅테크 '동병상련',2021.09.13 17:43,글로벌 증시 상승세를 주도했던 대형 기술기업(빅테크)에 대해 각국 정부가 강도 높은 규제책을 내놓자 시장이 민감하게 반응하고 있다. 세계 시가총액 1위 ...
"유진투자증권, 서울대 스타트업과 AI 투자정보 서비스 개시",2021.09.13 13:56,유진투자증권이 서울대학교 스타트업 딥트레이드(DeepTrade)와 협력해 인공지능(AI) 기반 종목 추천 서비스인 '엑스퍼센트(XPercent)&...
'별들의 전쟁' 한경 스타워즈 실전투자대회 오늘 개막,2021.09.13 09:30,국내 금융투자업계 대표 선수들이 참가하는 '2021 한경 스타워즈 실전투자대회'가 13일 개막한다. 한국경제신문이 주최하고 한경닷컴이 주관...
"""프로 골퍼 티샷도 거래""...신한금융, 골프대회 최초 NFT 발행",2021.09.10 16:09,신한금융그룹이 주최하는 제37회 신한동해오픈 출전 선수 60여 명의 티샷이 NFT(대체 불가능 토큰·Non Fungible Token)로 발...
"유틸렉스, 임상전문가 문한림 박사 자문위원 영입",2021.09.10 09:08,"유틸렉스는 임상전문가인 문한림 박사(사진)를 자문위원으로 영입했다고 10일 밝혔다. 각 후보물질별 임상시험 설계부터 전임상, 적응증 확대 등 임상 전반에..."
"엠피코, 러시아 코로나19 백신 유통 합작법인 'PBTG' 설립 본격화",2021.09.09 14:47,엠피코퍼레이션(엠피코)이 러시아의 신종 코로나바이러스 감염증(코로나19) 백신 '코비박'(CoviVac)의 국내 생산과 해외 유통을 위해 ...
"제이준코스메틱, '2021 올해의 브랜드 대상' 5년 연속 수상",2021.09.09 09:00,화장품 전문 제조업체 제이준코스메틱(제이준)이 '2021 올해의 브랜드 대상' 중국 마스크팩 부문에서 5년 연속 1위를 수상해 글로벌 코스...
(마감)코스피 기관 1184억 매도 우위,2021.09.08 15:35,한경닷컴
"카카오뱅크, 5거래일만에 반등 시도…오버행 우려 끝났나",2021.09.08 09:36,카카오뱅크가 5거래일만에 반등을 시도하며 유가증권시장 시가총액 순위 10위권에 다시 진입했다. 8일 오전 9시27분 현재 카카오뱅크는 전일 대비 1600...
"현대중공업, 청약 첫 날 5.5조 몰렸다···통합 경쟁률 40대 1",2021.09.07 16:49,현대중공업이 기업공개(IPO) 일반 청약 첫 날 5조원이 넘는 증거금을 끌어모았다. 첫날 경쟁률은 40대 1을 기록했다. 7일 대표 주관사인 미래에셋증권...
"나이벡, 항염증 펩타이드 동물실험 결과 SCI급 학술지 게재",2021.09.07 09:30,나이벡은 항염증 펩타이드에 대한 동물실험 결과를 과학기술논문인용색인(SCI)급 국제 학술지인 ‘The Journal of Biomedical ...
'겹호재'에 쑥쑥 크는 키다리스튜디오,2021.09.06 17:32,웹툰·웹소설 플랫폼 업체인 키다리스튜디오 주가가 사상 최고치를 기록했다. ‘틱톡’을 운영하는 중국 정보기술(IT) 업체...
"젠큐릭스, 액체생검 간암 조기진단 국내 허가임상 신청",2021.09.06 10:32,젠큐릭스는 액체생검 간암 조기진단 검사 '헤파이디엑스'의 국내 허가를 위한 임상 신청을 완료했다고 6일 밝혔다. 이 제품은 미량의 혈액으로...
"""제네시스 전기차 생산"" 발표 후 널뛰기 한 현대차 주가…왜?",2021.09.05 12:00,현대차가 럭셔리 브랜드인 제네시스 신차를 2030년부터 전기차로만 생산하겠다고 발표한 뒤 주가가 하락했다 하루 만에 상승 반전했다. 전문가들은 벤츠 등 ...
"'따상' 일진하이솔루스, 사흘 만에 하락 전환",2021.09.03 10:07,수소연료탱크업체 일진하이솔루스가 상장 사흘째인 3일 장 초반 하락세로 돌아섰다. 이날 오전 10시4분 현재 일진하이솔루스는 전 거래일 대비 3000원(3...
"카지노株 일제히 반등…""내국인 출입 업체 강원랜드 유망""",2021.09.02 15:48,카지노 관련주들의 주가가 반등 조짐을 보이고 있다. 외국인 전용 카지노 업체인 파라다이스가 지난달 카지노 매출이 급증했다고 발표하면서 투자자들의 기대도 ...
"KB증권, 글로벌원마켓 가입 고객 100만명 돌파",2021.09.02 09:47,KB증권은 해외주식 원화 거래 서비스인 '글로벌원마켓(Global One Market) 서비스 가입 고객이 100만명을 돌파했다고 2일 밝혔다. ...
"에이치피오, 각자 대표 체제로 재편…""성장전략 구체화""",2021.09.01 15:48,'덴프스'(Denps)라는 건강기능식품 대표 브랜드를 보유하고 있는 에이치피오는 기존 이현용 단독 대표 체제에서 3명의 대표가 각자의 사업...
"셀바스AI, 국내 최초 AI 의료 음성인식 솔루션 '셀비 메디보이스' 선보여",2021.09.01 11:02,인공지능 전문기업 셀바스AI가 '대한영상의학회 학술대회'(KCR 2021)를 통해 국내 최초 AI 의료 음성인식 솔루션 '셀비 메디...
 (1일) 신규상장=일진하이솔루스(271940) 등,2021.09.01 00:28,◇신규상장=일진하이솔루스(271940) ◇보통주추가상장=대호에이엘(전환) 엠씨넥스 크래프톤(이상 스톡옵션 행사)
"SKC, SK와 합병설 부인하자 강세",2021.08.31 11:37,SKC가 SK와의 합병설을 부인하자 31일 5% 넘게 상승하고 있다. 4거래일 만의 반등이다. 이날 오전 11시34분 현재 유가증권시장에서 SKC는 전날...
기술 더디고 '눈덩이 적자'…비틀대는 자율주행차,2021.08.30 17:28,미국 실리콘밸리의 혁신을 이끌어온 자율주행자동차 업계에 브레이크가 걸렸다. 잇단 차량 사고에 규제당국의 조사를 받는 업체가 늘어나면서 장밋빛 미래를 그렸...
"위메이드, 미르4 흥행 기대감에 16%대 상승세",2021.08.30 10:51,위메이드가 지난주 출시한 모바일 신작 '미르4'에 대한 흥행 기대감에 힘입어 급등세를 보이고 있다. 30일 오전 10시49분 기준 위메이드...
"""용돈으로 돈 벌자""…코인에 40억 쏟아부은 10대들",2021.08.29 14:21,10대들이 가상자산(암호화폐·코인)에 투자하고 있다. 국내 대형 코인 거래소에 쌓인 10대들의 원화 예치금만 40억원이 넘었다. 29일 국회...
'드래곤볼·원피스' 도에이애니메이션 사상 최고가에 팬주주도 환희,2021.08.27 15:30,'드래곤볼'이나 '원피스'로 유명한 일본 애니메이션 제작사 도에이애니메이션(4816)이 사상최고가 행진을 이어가고 있다. 코...
"메리츠證 ""GS건설, 하반기 실적 회복 기대감…자회사 모멘텀도 '부각'""",2021.08.27 08:26,"메리츠증권은 27일 GS건설에 대해 2분기 실적 부진 및 부동산 정책 기대감 악화로 주가 조정이 있었지만, 하반기 이후로는 급증한 주택 분양물량 등으로 ..."
" 원/달러 환율 2.4원 오른 1,170.5원(마감)",2021.08.26 15:31,/연합뉴스
"“휴켐스, MNB 장기계약에 배출권 가격 상승도…목표가 5%↑”-대신",2021.08.26 07:40,대신증권은 26일 휴켐스에 대해 모노니트로벤젠(MNB)의 장기 공급계약을 맺은 데 더해 탄소배출권 가격이 상승하는 두 가지 희소식이 전해졌다며 목표주가를...
"코스피, 금통위·잭슨홀미팅 앞두고 혼조세 마감",2021.08.25 16:02,"코스피가 한국 기준금리 인상 여부가 주목되는 한국은행 금융통화위원회, 미국 통화정책 변화의 힌트가 나올 수 있는 잭슨홀 미팅을 앞두고 혼조세를 보였다. ..."
"휴젤, 1.5조원 규모 주식 양수도 계약으로 최대주주 변경 [주목 e공시]",2021.08.25 08:41,휴젤은 현재 최대주주 LEGUH ISSUER DESIGNATED ACTIVITY COMPANY가 보유주식 535만5651주(지분율 42.895%)를 1조...
" 원/달러 환율 8.1원 내린 1,165.6원(마감)",2021.08.24 15:31,/연합뉴스
"키움證 ""JYP엔터, 하반기 아티스트 모멘텀 강화…실적 개선 전망""",2021.08.24 08:38,키움증권이 24일 JYP엔터테인먼트에 대해 하반기에도 팬덤 성장과 함께 실적 개선 흐름을 지속할 것이라고 전망했다. 이에 투자의견 '매수'...
(마감)코스피 기관 6085억 매수 우위,2021.08.23 15:37,한경닷컴
"셀트리온 3형제, 코로나19 항체치료제 美·유럽 진출 기대감에 급등",2021.08.23 10:10,셀트리온그룹 3사가 신종 코로나바이러스 감염증(코로나19) 항체치료제 '렉키로나'의 미국·유럽시장 진출 임박 기대감에 강세를 ...
"매출 10억달러 혁신치료제 줄줄이 대기…高성장 기업 노바티스, 배당까지 짭짤",2021.08.22 17:27,노바티스는 혁신신약을 담당하는 IM 사업부와 제네릭 및 바이오시밀러를 담당하는 산도즈 등 총 2개 사업부로 구성돼 있다. 혁신치료제 등 노바티스의 주요 ...
" 원/달러 환율 3.4원 오른 1,179.6원(마감)",2021.08.20 15:31,/연합뉴스
 (20일) 신규상장=아주스틸(139990) 등,2021.08.20 02:31,◇신규상장=아주스틸(139990) ◇보통주추가상장=STX(유상증자) 두산중공업(신주인수권행사) 금호에이치티 풀무원(이상 전환)
"펄어비스, 16%대 상승세… 장중 시총 5위로",2021.08.19 11:58,"게임 개발사 펄어비스가 19일 장중 급등세를 보이며 SK머티리얼즈, 에이치엘비, 엘앤에프 등을 제치고 코스닥 시가총액 규모 5위로 올라섰다. 19일 오전..."
"""오늘은 제발 올라주길""…삼성전자, 450만 개미들의 기도",2021.08.19 08:43,삼성전자가 '국민주' 자리를 굳건히 했다. 최근 9거래일간 주가가 맥을 못 추고 있지만 개인 투자자의 지분율은 작년 말 대비 두 배로 급증...
(마감)코스피 기관 4095억 매수 우위,2021.08.18 15:39,한경닷컴
"선앤엘, 올 상반기 매출 2242억 달성…전년 동기比 5.7%↑",2021.08.18 10:37,목재·생활용품 펌프 디스펜서 제조사 선앤엘(SUN&L)이 상반기 연결기준 매출이 전년 동기 대비 5.7% 늘어난 2242억원을 기록했다고 1...
"""농심, 분기별 점진적 회복세 전망""-NH",2021.08.18 07:57,"NH투자증권은 농심에 대해 분기별 점진적 회복세가 전망된다며 투자의견 '매수', 목표주가 41만5000원을 유지했다. 조미진 NH투자증권 ..."
"코스피 0.89%, 코스닥 2.86% 급락…삼전 내리고 카뱅 오르고",2021.08.17 16:15,코스피지수가 연일 계속되는 외국인 순매도에 1% 가까이 하락했다. 코스닥지수도 낙폭을 키우면서 3% 가까이 내렸다. 미국과 중국의 경제지표가 부진한 결과...
"KTB투자증권, 상반기 순이익 928억···전년比 1327.7%↑",2021.08.17 13:08,KTB투자증권은 올 상반기 순이익이 928억원을 기록하며 반기만에 지난해 연간 순이익을 훌쩍 뛰어넘는 사상 최대이익을 달성했다고 17일 밝혔다. KTB투...
"원/달러 환율 하락 출발 후 반등…장초반 1,170원 돌파",2021.08.17 09:27,"17일 원/달러 환율이 하락 출발한 뒤 반등해 장 초반 1,170선을 돌파했다. 이날 서울 외환시장에서 오전 9시 18분 현재 원/달러 환율은 전거래일 ..."
계속되는 '셀 코리아' 조정 불가피…테이퍼링 시점 '주목' [주간전망],2021.08.16 12:31,지난 주 코스피지수는 외국인의 '매도 폭탄'에 석 달 만에 3200선 아래로 떨어졌다. 반도체 업황에 대한 부정적인 전망이 잇따르자 시가총...
계속되는 '셀 코리아' 조정 불가피…테이퍼링 시점 '주목' [주간전망],2021.08.16 12:31,지난 주 코스피지수는 외국인의 '매도 폭탄'에 석 달 만에 3200선 아래로 떨어졌다. 반도체 업황에 대한 부정적인 전망이 잇따르자 시가총...
"쇼박스, 넷플릭스와 OTT 계약 소식에 10%대 강세",2021.08.13 11:43,영화 투자배급사 쇼박스가 넷플릭스와 공급 계약을 체결했다는 소식에 강세를 보이고 있다. 13일 오전 11시36분 현재 쇼박스는 전일보다 420원(10.1...
